claim,summary,review,date,url,useful,,claim_entered
"Says Sen. Thom Tillis voted to ""take away"" coverage for people with pre-existing conditions.","Cunningham says Tills voted to 'take away' coverage for pre-existing conditions. Tillis has repeatedly voted to repeal the Affordable Care Act, also known as Obamacare. If those repeal experts had been successful, people with pre-existing conditions could have been left without health care coverage. Tillis later introduced legislation that attempts to protect people with pre-existing conditions, but experts say it doesn't match the ACA's protections.","From Republican U.S. Senate candidates, voters are likely to hear about the economy under President Trump. From Democratic Senate candidates, voters are likely to hear about the need for better health care policy. Nowhere is that more true than North Carolina, where a handful of Democrats are vying to knock out incumbent Republican Thom Tillis. One of them is Cal Cunningham, who has support from the Democratic Party establishment. The Cunningham campaign recently released an ad accusing Tillis of voting to ""take away"" coverage for pre-existing conditions. The Feb. 5  tweet  says, ""Without coverage for pre-existing conditions, Susie and her family would be bankrupt. Those protections are exactly what Thom Tillis voted to take away."" Included in the tweet is a video that profiles a mother named Susie who says her daughter has a pre-existing condition. ""Without pre-existing condition coverage, we would be bankrupt,"" Susie says.  Cunningham then appears on screen to say, ""Those protections for Susie’s children are exactly what Thom Tillis voted to take away."" Then this text appears over a photo of Tillis: ""Tillis voted against protections for pre-existing conditions."" Is it true that Tillis voted to take away coverage for people with pre-existing conditions? Yes. Tillis voted to repeal a law, the Affordable Care Act, that provides that coverage. While repeal efforts have been unsuccessful, repealing and replacing the ACA has been part of the Tillis platform for years. He voted to repeal the ACA, and later proposed a different law that aims to address pre-existing conditions. But experts say the Tillis plan, along with other Republican proposals, fall short of offering the coverage in the ACA. First, some background. A pre-existing condition is a health problem that someone has before their health coverage starts. Examples include asthma, cancer, diabetes or lupus. Prior to the passage of the Affordable Care Act, also known as Obamacare, insurers could deny coverage to people with pre-existing conditions or inflate their premiums so much that they dropped coverage, as  PolitiFact  and  its partners  have previously reported. The Cunningham ad specifically mentions a vote from July 26, 2015: the roll call for a vote to allow the repeal of the health care law. You can see from the bill’s ""statement of purpose"" that it was meant to ""repeal the Patient Protection and Affordable Care Act and the Health Care and Education Reconciliation Act of 2010 entirely.""  The record shows Tillis voted to repeal it. ""Certainly, this provision, if enacted, would have removed coverage of pre-existing conditions because it would have repealed the ACA in its entirety, which would have restored law to what it was prior to 2010, when pre-existing conditions often were not covered in most states, or by federal law,"" said Mark Hall, a law and health professor at Wake Forest University. PolitiFact has  repeatedly  determined that a vote to repeal the ACA in full would have stripped coverage for people with pre-existing conditions. Subsequent GOP-written bills to replace the ACA have not ensured the same level of patients with those conditions. When PolitiFact reached out to the Tillis campaign, spokesman Andrew Romeo didn’t dispute Tillis’ vote from 2015.  But he claimed Tillis has always supported replacing Obamacare ""with a health care law that retains that critical provision, in addition to ensuring Americans under the age of 26 can stay on their family's health plan,"" Romeo said. He added that Tillis has ""taken steps to ensure that patients with pre-existing conditions maintain those protections regardless of Obamacare's future."" Romeo was referencing a bill Tillis co-sponsored known as "" The Protect Act ,"" which claims to protect people with pre-existing conditions. But  experts say  that bill falls short. Karen Pollitz, a senior fellow studying health reform and private insurance for the Kaiser Family Foundation, said the bill doesn’t prevent insurance companies from price gouging. The bill includes language prohibiting discrimination based on health status. But, Pollitz said, it doesn’t prohibit insurers from charging women more than men. She paraphrased lines on pages 9 and 10 of the  bill , saying ""nothing in the nondiscrimination requirement ‘shall be construed to restrict the amount that an employer or individual may be charged for coverage under a group health plan except as provided in paragraph 3 or individual health coverage’."" Pollitz said Tillis may have attempted to include price-gouging protections, ""but the language they used is riddled with loopholes that would continue to permit discriminatory rating practices."" To prevent price gouging, health bills should offer subsidies. Tillis’ bill guaranteed the issuance of insurance but didn’t provide funding to make premiums affordable, said David Anderson, research associate at Duke University’s Center for Health Policy. Under Tillis’ bill, Anderson said there was little incentive to keep healthy people in the market pool. So insurers would have two options. ""They can either leave the market entirely or dramatically increase premiums to cover a very sick and expensive group of people,"" he said. ""Since there are no premium subsidies in this bill, insurance will be too expensive for individuals who are in good health to purchase."" PolitiFact reported  in 2019 that most of the Republican health care plans fail to fully protect people with pre-existing conditions. A fact-check of White House chief of staff Mick Mulvaney singled out the plan proposed by Tillis and other Republican senators. It found that the bill included an option for companies to deny certain coverage if they weren’t able to ""adequately"" deliver services. That fact-check quote critics of Obamacare, such as health care consultant Bob Laszewski and former Republican Senate health care policy staffer Rodney Whitlock, saying the Republican proposals fall short of the coverage offered by the ACA. Cunningham’s ad says Tillis voted to take away coverage for pre-existing conditions. It’s true that Tillis voted for a straight repeal of the Affordable Care Act, a move that likely would have left Americans with pre-existing conditions vulnerable. Tillis’ campaign is right to point out that he has tried to address the issue. But experts agree that the Tillis proposal left loopholes insurance companies could use against people with pre-existing conditions. Cunningham’s statement overlooks some of Tillis’ efforts. But it’s correct about Tillis’ vote and the fact that other Republican plans fall short of matching the ACA’s protections for people with pre-existing conditions. We rate it Mostly True. An earlier version of this fact check quoted an expert who said the ""Protect Act"" introduced by Sen. Tillis would have allowed insurance companies to avoid covering people’s pre-existing conditions. In fact, the bill was written to prevent insurance companies from doing that. The expert has revised her comments.  This correction has no bearing on the overall rating. Tillis voted to fully repeal the ACA, and bills proposed by Tillis and other Republicans still fall short of matching the ACA’s protections for people with pre-existing conditions.",3/2/20,https://www.politifact.com/factchecks/2020/mar/02/cal-cunningham/cunningham-says-tills-voted-take-away-coverage-pre/,1,,Sen. Thom Tillis voted to take away coverage for people with pre-existing conditions
"""Not once in his entire career in Washington, D.C., which started way back in 1991, has Democratic Socialist Bernie Sanders ever voted yes on sanctions against Russia.""","Fact-checking Bernie Sanders’ record of voting on sanctions against Russia.   Sanders voted in favor of sanctions against Russia in 2017 as an amendment to a larger bill. But Sanders voted against the final legislation.       Sanders supported an expansion of the Magnitsky Act, which imposed visa bans and asset freezes on Russian officials.     Sanders missed a vote related to sanctions on companies linked to Oleg Deripaska, a Russian billionaire with ties to Russian President Vladimir Putin.","From honeymooning in the Soviet Union in 1988 to getting love from Russia for his presidential bids, Bernie Sanders has an uncommon connection with one of America’s chief adversaries. It’s subjected the Vermont senator to a number of attacks. On Feb. 22, 2020, the day Sanders won the Nevada caucuses and arguably established himself as the frontrunner for the Democratic presidential nomination, a  post  claimed:  ""Not once in his entire career in Washington, D.C., which started way back in 1991, has Democratic Socialist Bernie Sanders ever voted yes on sanctions against Russia."" Sanders has run as an independent in Vermont, was a member of the U.S. House from 1991 to 2007, and has since been a member of the Senate. He calls himself a democratic socialist. There aren’t many votes to look at when it comes to Russia, and Sanders’ voting history isn’t as clear-cut as the post claims.  In recent years, the United States sanctioned Russia in response to allegations of corruption and human rights abuses. It continued sanctions after Russia’s invasion of Ukraine.  Some of the sanctions were imposed by presidential executive order, without any vote in the Senate. Here are the key votes: Dec. 6, 2012:  Sanders  voted no  on the Magnitsky Act, which  imposed  visa bans and asset freezes on Russian officials linked to the 2009 death in prison of Sergei Magnitsky, a 37-year-old Russian whistleblower.  GQ  reported  on Feb. 23, 2020, that Sanders never explained his vote, but ""fellow Dems suggest that it was because a free trade provision had been tucked into the legislative package."" Sanders’ campaign emphasized to us that in 2015, the Senate with unanimous consent  extended  the law to countries other than Russia, and said it was ""more robust"" than the original law.  June 14 and 15, 2017:  Sanders  votes yes  on an amendment to a bill, adding Russia to a bill that was  sanctioning  Iran. But the next day, Sanders voted no on the overall  legislation , which put new sanctions on North Korea, as well as Russia and Iran. On Russia, the bill  targeted  the country’s aggression in Ukraine and Syria, citing corruption, human rights abuses and weapons sales.  Sanders said at the time he feared the bill would endanger the 2015 nuclear deal, which was aimed at curbing Iran’s ability to develop a nuclear weapon. ""I am strongly supportive of the sanctions on Russia included in this bill. It is unacceptable for Russia to interfere in our elections here in the United States, or anywhere around the world. There must be consequences for such actions,"" he said in a  statement  at the time. Jan. 16, 2019:  The Senate  failed  to stop the Trump administration from easing sanctions on companies linked to Oleg Deripaska, a Russian billionaire with ties to Russian President Vladimir Putin.  Sanders missed the vote, but his absence did not affect the outcome. He was  meeting  with women who accused his 2016 presidential campaign of sexual misconduct. A post claims: ""Not once in his entire career in Washington, D.C., which started way back in 1991, has Democratic Socialist Bernie Sanders ever voted yes on sanctions against Russia."" Sanders voted once, in 2017, to add Russia to a sanctions bill. But on the final version of that bill, which carried sanctions against Russia, North Korea and Iran, he voted no. Moreover, he voted no on a Russia sanctions bill in 2012. The statement is partially accurate. We rate it Half True.",2/27/20,https://www.politifact.com/factchecks/2020/feb/27/tweets/dating-back-1991-and-his-time-house-bernie-sanders/,1,,Bernie Sanders never voted yes on sanctions against Russia
Says Mitt Romney voted against convicting President Donald Trump because Burisma board member Joseph Cofer Black “is Romney’s national security advisor” and because of ties to Obama CIA director John Brennan.,"Meme spreads dubious theory about why Mitt Romney voted to convict. Joseph Cofer Black was one of many foreign policy advisers to Mitt Romney’s 2008 and 2012 presidential campaigns, and he serves on the board of Burisma, the Ukrainian energy company. However, Black is not currently “Romney’s national security advisor.”     There’s no evidence of any close relationship between John Brennan and Romney. In fact, Brennan was working in the Obama administration when Romney was running against him in the 2012 presidential campaign.    Romney laid out his rationale for voting to convict Trump when he said that Trump abused his power. We see no evidence that his years-old ties to Black are more persuasive in explaining his historic and polarizing vote.","After Sen. Mitt Romney, R-Utah, joined all Senate Democrats in voting to convict President Donald Trump on an article of impeachment, he became a target of social media ire from Trump allies. One example is a Jan. 31  Facebook post  by the  Committee to Defend the President , a  pro-Trump political action committee  that says on its Facebook page, ""The Crooked Media has shown us time and time again that they can not be trusted, we will defend him!"" The post, which was shared about 8,000 times, features photographs of Romney and two former CIA officials, Joseph Cofer Black and John Brennan. It says: ""If you don’t know who the guy in the middle (Black) is, you had better get up to speed, and fast. Joseph Cofer Black is Romney’s national security advisor. He also currently sits on the board of Burisma holdings. JCB joined the CIA in 1974, and was the head of their counter-terrorism center during the 9/11 terror attacks. John Brennan was the CIA station chief in Saudi Arabia who approved the sketchy visas for the 9/11 attackers. He followed JCB as the head of CIA’s counter-terrorism. And this is just scratching the surface of their relationships."" The post was flagged as part of Facebook’s efforts to combat false news and misinformation on its News Feed. (Read more about our  partnership with Facebook .) We found that the post sprinkles a few facts — and a few erroneous assertions — into an unsupported claim. We’ll take the elements one by one. While Joseph Cofer Black has advised Romney in the past, he is not currently his ""national security advisor,"" Romney’s office confirmed. Black served as director of the CIA’s Counterterrorism Center from 1999 to 2002 and as U.S. ambassador-at-large for counterterrorism from 2002 to 2004. Since then, he’s worked in the private sector, including a stint as vice chairman of Blackwater, a controversial security contractor.  Black’s relationship with Romney came primarily during Romney’s two presidential campaigns. Black served as senior adviser for counterterrorism and national security on  Romney's 2008 presidential campaign , then served as a special adviser for national security and foreign policy on  Romney’s 2012 presidential campaign . The 2012 campaign team assembled dozens of foreign policy experts from the party, as is typical for both Republican and Democratic presidential candidates.  This appears to be correct, according to the Ukranian energy company’s  website . When we checked it on Feb. 7, 2020, Black was  listed  as a director of the company. (The company’s press office did not respond to an inquiry.) In fact, at one point, Black served on the board at the same time as Hunter Biden — the son of former Vice President Joe Biden who became a target of President Donald Trump and whose service on Burisma’s board inspired the actions that led to Trump’s impeachment. Here’s an archived version of the company’s  website  in 2017, showing both Biden and Black. In a  news release  about Black’s hiring in 2017, Black is quoted saying, ""I was impressed to learn that Burisma Group is the fastest-growing private gas producer in Central Europe. International projects where the Group is involved require a more thorough analysis and risk assessment, not only in terms of conventional risks — financial or political but also in terms of security."" That’s correct.  As the Daily Beast  noted  in 2012, then-CIA chief George Tenet wrote that after the 9/11 attacks, Black insisted on staying at his office with his staff in a relatively exposed area of the CIA headquarters, rather than moving to a safer location. ""Well, they could die,"" Tenet recalls telling Black about his staff. Black responded, ""Well sir, then they are just going to have to die."" This is false. First, the CIA does not handle visas — the State Department does. The congressionally authorized 9/11 report went into detail about how each of the plot participants secured their visas. ""Individual consular officers (were) involved with the adjudication of visas to the hijackers,""  the report said . Second, during the time that Brennan was  posted  in Saudi Arabia, only a few of the visas were granted to the plotters (and not all of the terrorists got their visas in Saudi Arabia). Shortly after the plot quietly went into motion in 1999, President George W. Bush tapped Brennan to serve as chief of staff to Tenet at CIA headquarters, so Brennan was in the United States for most of the time the attack’s planning was underway. He was named the CIA’s deputy executive director in 2001, serving through 2003. ""He never approved a single U.S. visa,"" said Nick Shapiro, a spokesman for Brennan. This is false, although similar names have tripped up some non-experts. Black was  head  of the CIA’s counter-terrorism center, commonly known as CTC, from 1999 to 2002. The center is a part of the CIA. Brennan, by contrast, was named by Bush as  interim director  of the National Counterterrorism Center, an inter-agency group under the umbrella of the Director of National Intelligence. Brennan served in the post from 2004 to 2005. This is ironic, since during the 2012 presidential campaign, Black was working on behalf of Romney, the Republican challenger, while Brennan was working in the administration of the incumbent, President Barack Obama. The 2012 Daily Beast article specifically pairs the two as combatants. Black, the article said, was Romney’s ""trusted man inside the intel community,"" while Brennan’s role for Obama in the administration was ""so powerful that many senior spies complain that Brennan is the de facto CIA chief."" (He would later be named CIA director by Obama.) ""I am not aware of any connection between Gov. Romney and John Brennan, nor can I imagine any, since Brennan was with Obama,"" Andrew Natsios, a professor at Texas A&M’s Bush School of Government and Public Service, told PolitiFact. Natsios is also a former administrator of the U.S. Agency for International Development who served on the same 2012 Romney advisory panel as Black did. That said, times have changed in the Trump era, as Brennan has praised Romney for his stance on impeachment.  In October, Brennan  tweeted , ""How many other Republican Senators are ready to show the courage, integrity, & principled position of Senator Romney?  Thank you, Senator, for putting our Nation & our Constitution above party politics & the corrupt behavior of Donald Trump."" Foreign policy experts said it is unlikely that Romney was thinking of protecting an adviser from eight years ago when weighing one of the most important votes he would ever cast in the Senate. Romney laid out his reasoning for voting to convict in his widely noted  Senate floor speech .  ""Given that in neither the case of the father nor the son was any evidence presented by the president’s counsel that a crime had been committed, the president’s insistence that they be investigated by the Ukrainians is hard to explain other than as a political pursuit,"" Romney said. He continued: ""The grave question the Constitution tasks senators to answer is whether the President committed an act so extreme and egregious that it rises to the level of a ""high crime and misdemeanor. Yes, he did."" The Committee to Defend the President did not respond to an inquiry for this article. A Facebook post says that Romney voted against convicting Trump because Burisma board member Joseph Cofer Black ""is Romney’s national security advisor"" and because of ties to Obama CIA director John Brennan. The meme mixes a few facts with several inaccuracies to make an unsupported assertion. Black was an advisor to Romney’s 2008 and 2012 campaigns, and according to Burisma’s website, he serves on the company’s board. However, we see no evidence that Black is still advising Romney eight years later, and the notion that Brennan is close to Romney is undermined by the fact that he was working for the Obama administration when Romney was trying to unseat Obama in the 2012 presidential race. All told, Romney’s public explanation about why he voted to convict in such an important case is clear and more plausible than a desire to protect an adviser from eight years ago. We rate the statement False. CLARIFICATION, Feb. 10, 2020:  This article has been updated to clarify that Brennan was not working on Obama's 2012 campaign but was rather working for the Obama administration.",2/10/20,https://www.politifact.com/factchecks/2020/feb/10/committee-defend-president/meme-spreads-dubious-theory-about-why-mitt-romney-/,1,,Mitt Romney voted against convicting President Donald Trump
"Says William Barr tweeted, “BREAKING NEWS Senator Mitt Romney is the only Republican Senator who voted to remove President Trump from office… IN A COMPLETELY UNRELATED STORY Senator Mitt Romney is also the only Republican Senator who has a son who sits on the board of a Ukrainian Energy Company.”","No, William Barr didn’t tweet this about Mitt Romney. The tweet was published by a parody account.  Mitt Romney was the only Republican to vote to convict Donald Trump of abuse of power.  There’s no evidence any of his sons have served on the board of any energy company with ties to Ukraine.","U.S. Sen. Mitt Romney  was the only Republcan to vote to convict President Donald Trump  of abuse of power. Attorney General William Barr appeared to acknowledge that on Twitter on Feb. 5, at least if you saw  this Facebook post .  The Feb. 6 post features a screenshot of tweet from ""A.G. William Barr,"" whose Twitter handle is @AGWilliamBarr. ""BREAKING NEWS,"" the Feb. 5 tweet says, ""Senator Mitt Romney is the only Republican Senator who voted to remove President Trump from office… IN A COMPLETELY UNRELATED STORY Senator Mitt Romney is also the only Republican Senator who has a son who sits on the board of a Ukrainian Energy Company."" This post was flagged as part of Facebook’s efforts to combat false news and misinformation on its News Feed. (Read more about our  partnership with Facebook .)  The tweet  is real , but the account doesn’t belong to Barr. What’s not clear from the Facebook post is that @AGWilliamBarr is  a parody account .  ""The Official PARODY Account of the Attorney General with the USA,"" the Twitter bio says. ""Followed by Corn Pop, Blocked by Pierre Delecto & RT’d by Right Wing Conspiracy Theorists."" As for whether Romney has a son on the board of a ""Ukrainian Energy Company,"" we’ve  already fact-checked that . There’s no evidence any of his sons have served on the board of any energy company with ties to Ukraine.  We rate  this Facebook post False. ",2/7/20,https://www.politifact.com/factchecks/2020/feb/07/viral-image/no-william-barr-didnt-tweet-about-mitt-romney/,1,,Senator Mitt Romney is the only Republican Senator who voted to remove President Trump from office
