claim,summary,review,date,url,useful,,claim_entered
"“The House voted to cap insulin prices to $35/month, just $420 each year! Richard Hudson voted NO.”",NC Democrat falsely claims Republican Richard Hudson opposed insulin price cap.,"With inflation high and many Americans concerned about COVID-19, a Democratic congressional candidate in North Carolina says a Republican incumbent isn’t doing enough to ease the burden of medical costs. State Sen. Ben Clark, D-Hoke, is running in the state’s newly-drawn 9th Congressional District, where he’ll face Republican U.S. Rep. Richard Hudson if both win their primaries. The district, which leans Republican, is located in south-central North Carolina near Fayetteville. On April 1, Clark’s campaign emailed supporters slamming Hudson for how he voted the day before. The email said: ""Yesterday, the House voted to cap insulin prices to $35/month, just $420 each year! Richard Hudson voted NO."" Clark’s campaign also tweeted about Hudson, posting that he ""voted no to lowering the cost of insulin for every family in the 9th Congressional District."" What legislation was Clark talking about? And did Hudson really vote against lowering insulin costs? A review of the record shows Clark got this wrong. The U.S. House of Representatives on March 31 voted on H.R.6833, known as the Affordable Insulin Now Act, which would cap insulin co-payments for insured Americans at $35 a month.It would help some Americans save hundreds of dollars annually and offer all insured patients more predictable insulin costs, but wouldn’t help the uninsured, the  Associated Press reported . The Democrat-led bill passed 232-193 with the help of 12 Republicans — and congressional records show  Hudson was one of them . Several media outlets — including  Business Insider , the  Daily Mail  and  Yahoo! News  — named Hudson among the bill’s Republican supporters. PolitiFact NC reached out to Clark’s campaign shortly after it published the email and tweet about Hudson’s vote. The campaign, which  deleted its tweet  about Hudson, defended its accusations. As far as we know, the Clark campaign hasn’t issued a correction to its email. ""We are aware that last night Richard Hudson changed his vote on capping the cost of insulin to $35/month after voting against this and other bills to reduce the cost of prescription drugs numerous times,"" the campaign said. ""After being consistently rated as one of the most conservative Republicans in the House, no one is fooled by his recent shift to the center."" We asked the campaign what it meant when it said Hudson changed his vote, but didn’t receive a response. Hudson’s office said the congressman’s March 31 vote is in line with other efforts to reduce insulin prices. Jordan Shaw, one of Hudson’s advisors, said Hudson  co-sponsored  the Lower Costs, More Cures Act of 2019, or H.R. 19, which would have capped the cost of insulin for  some Medicare customers . ""Congressman Hudson was proud to vote to cap out-of-pocket costs for seniors on insulin, and has long advocated for caps on prescription drug costs like those in HR 19. He didn’t change his vote,"" Shaw said.  Clark said: ""Yesterday, the House voted to cap insulin prices to $35/month, just $420 each year! Richard Hudson voted NO."" The congressional record and multiple media reports show Hudson voted yes. We rate Clark’s claim False.",4/4/22,https://www.politifact.com/factchecks/2022/apr/04/ben-clark/nc-democrat-falsely-claims-republican-richard-huds/,1,,Richard Hudson voted against capping insulin prices
"Mo Brooks ""voted to cut off funding to destroy ISIS terrorists in the middle of the fight.""","Attack on Trump-backed Mo Brooks distorts his votes on ISIS.   The ad cites two Brooks votes, neither of which was an up-or-down vote on funding U.S. military operations against ISIS.     Brooks’ votes were for measures that would have required congressional authorization of the use of military force against ISIS before funding for such military action could be approved.","The Republican endorsed by former President Donald Trump for an open U.S. Senate seat in Alabama tried to undercut the U.S. fight against the ISIS terrorist organization, according to one TV ad attacking him.  U.S. Rep.  Mo Brooks  faces two other major GOP challengers in the May 24 primary and is being attacked in TV, radio and Facebook ads from Alabama’s Future, a super PAC  formed  to oppose his candidacy.  In the  ad , a narrator said Brooks voted ""to cut off funding to destroy ISIS terrorists — in the middle of the fight."" Small text appearing in the ad alludes to Brooks’ votes for two failed proposals that had more to do with congressional authorization of military action against ISIS than cutting off funding for such action. They pertained to two amendments to Defense Department appropriations bills. National security expert John Pike of GlobalSecurity.org said the amendments ""had nothing to do with blowing up ISIS and had everything to do with a congressional assertion of having a role in the war powers.""  ISIS , also known as the Islamic State, seized control of territory in Syria and Iraq starting in  2014 , the year the campaign to defeat the Islamic militant group  took shape . One of Brooks’ votes regarding ISIS occurred in 2015 and the other in 2016, as major U.S. military operations were carried out. It wasn’t until mid-2017 that ISIS, after losing much of the territory it had seized,  collapsed . So, it’s fair to say that the two Brooks votes occurred during, as the ad claimed, ""the middle of the fight,"" according to Pike and national security expert Daveed Gartenstein-Ross, who oversees Valens Global, a private national security consulting firm. But both said the ad’s claim against Brooks is oversimplified. Alabama’s Future has spent $2.89 million in the 2021-22 election cycle,  according  to the nonprofit Open Secrets. It’s not clear who organized the group, which  does not  disclose its donors to the Federal Election Commission. Alabama’s Future did not respond to our requests for information about the claim in the ad we’re checking. But the ad — along with another  version  of the TV ad we’re checking,   two   radio  ads and a  Facebook  ad — identifies the two Brooks votes.  In both cases, Brooks voted in favor of an amendment to annual appropriations bills for the Defense Department. Neither amendment passed. On June 11, 2015, the House  voted  on an  amendment  to the 2016 appropriations  bill . The amendment would have prohibited the use of funds for Operation Inherent Resolve, as the campaign to defeat ISIS was known, without Congress first enacting a law authorizing the use of military force against ISIS. The amendment failed on a vote of 231-196. Brooks was one of 33 Republicans to vote yes, along with 163 Democrats, including Pelosi, the House speaker. The other six Alabama House  members , including the lone Democrat, Terri Sewell, voted no.  The amendment’s sponsor, Rep. Adam Schiff, D-Calif.,  said  at the time that he wanted no money spent ""for the war against ISIS after a certain date in March of next year unless Congress authorizes a war against ISIS."" The second vote came on June 16, 2016, when the House  voted  on an  amendment  to the 2017 appropriations  bill . The amendment would have prohibited funds being obligated for combat operations in Iraq or Syria unless an authorization for the use of military force, known as an AUMF, had been enacted.  That amendment was proposed by Rep. Jim McGovern, D-Mass. He  said  at the time: ""Quite simply, if you want the money to fight a war, then pass an AUMF."" The amendment failed on a vote of 285-130. Brooks was one of 17 Republicans to vote for the amendment, along with 118 Democrats, including Pelosi. Again, the other Alabama House  members  voted no. Gartenstein-Ross said that had either amendment become law, the funding for the fight against ISIS would have come to an end — but in that case, Congress could simply have taken the separate step of authorizing such military action. ""It’s highly likely"" that Congress would have approved an authorization for the use of military force, he said. A key aim of the amendments was to give Congress authority over the military actions that had been originally authorized after the 9/11 terrorist attacks some 15 years earlier, Gartenstein-Ross said. That’s significant because that  military force authorization  specifically targeted organizations and persons who ""planned, authorized, committed, or aided the terrorist attacks that occurred on September 11, 2001,"" and by the time Brooks’ amendment votes were taken, ISIS had split from al-Qaida, the terrorist group responsible for the 9/11 attacks, Gartenstein-Ross said. Michael O'Hanlon, director of research in foreign policy at the Brookings Institution, said some House members would only have supported funding for the war against ISIS if there were first congressional authorization. But some members voting for the amendments were simply trying to restore stronger congressional oversight on the use of force by the United States, he said. Brooks’ campaign noted that Brooks voted for  the   two  appropriations bills themselves.  In February 2015, Brooks  raised  questions about how spending money on fighting ISIS would affect other defense priorities and whether other nations would help the U.S. combat ISIS. And in June 2015, Brooks  said  an authorization of force proposed by President Barack Obama was ""weak"" because it was vague and had a three-year time limit.  ""If we’re going to get in there, the president needs to have whatever authorization he needs to win and I’ll vote for that kind of authorization for use of military force,"" Brooks said. ""But I’m not going to vote for one that replicates the problems and loss of lives associated with Vietnam, where we don’t get in there to win, where we hamstring ourselves.""  Brooks has  faced   criticism  for the votes before. A  2017  ad made a similar attack on Brooks, claiming he ""voted to cut off funding to fight ISIS."" A Birmingham TV station’s fact-check  called  the claim ""true but misleading.""  The Alabama race is to succeed Republican Sen.  Richard Shelby , who was first elected to the Senate in 1986 and is not seeking re-election.  The outcome could help determine which party controls the Senate, now split  50-50 . Since campaign watchers rate the race as  safe  or  solid   Republican , the outcome of the May 24  primary  is key.  The other major GOP candidates are former Shelby aide Katie Britt and Army veteran Mike Durant. If no candidate receives a majority of the votes, a primary runoff election for the top two finishers would be held June 21. Alabama’s Future claimed in an ad that Brooks ""voted to cut off funding to destroy ISIS terrorists in the middle of the fight."" The ad alludes to two votes, one in 2015 and one in 2016 during U.S. combat operations against ISIS in Iraq and Syria. Neither was an up-or-down vote on funding military operations against the terrorist group. What Brooks voted for were measures that would have required congressional authorization of military action against ISIS before any funding of such operations could be approved. The ad contains an element of truth, but ignores critical facts that would give a different impression. We rate it Mostly False. PolitiFact staff researcher Caryn Baird contributed to this report.",3/22/22,https://www.politifact.com/factchecks/2022/mar/22/alabamas-future/attack-trump-backed-mo-brooks-distorts-his-votes-i/,1,,Mo Brooks voted to cut off funding to destroy ISIS terrorists in the middle of the fight.
"Eric Schmitt “sponsored a bill to spend $480 million of your tax dollars” on cargo hub for airlines ""owned by China's Communist Party” and ""voted to let China buy up Missouri farmland.""","In race for open US Senate seat in Missouri, fact-checking a PAC attack on Eric Schmitt over China.   A bill Schmitt sponsored originally called for $480 million in tax credits, not state expenditures, for the Missouri hub.     A law Schmitt voted for allows for limited ownership of Missouri agricultural land by foreign businesses.","Some Republicans running for open U.S. Senate seats are being hit from the right with attack ads that accuse them of cozying up to China. One of the ads, from a conservative super PAC that is funded by a large Illinois GOP donor, used the Winter Olympics in Beijing as a backdrop to brand Missouri Attorney General Eric Schmitt as ""good for China, bad for Missouri."" The  TV ad  from Team PAC, which is  supporting  former Missouri Gov. Eric Greitens in the race, is called ""Mao Money."" It  aired  Feb. 4  during  the broadcast of the opening ceremonies of the Games.  The ad opened with images of fireworks behind the words ""China 2022."" The narrator said, ""How did China get so powerful? Friends like Eric Schmitt."" Then it makes a two-part claim. ""Schmitt sponsored a bill to spend $480 million of your tax dollars to create a cargo hub here for airlines owned by China's Communist Party to flood Missouri markets with cheap Chinese imports,"" the narrator continued, ""and Schmitt voted to let China buy up Missouri farmland."" Both parts of the claim are rooted in bills Schmitt supported in the legislature, but they omit important context about the effect of the legislation. The first part of the super PAC’s claim centers on a 2011 bill Schmitt proposed as a state senator, connected to what was known as the China Hub Project.  As  reported  by the St. Louis Post-Dispatch, the initial bill would have offered up to $480 million worth of tax breaks over 15 years to spur foreign trade through Lambert-St. Louis International Airport. The bill was proposed as St. Louis leaders entered their fourth year of negotiations with Chinese officials over a freight hub at the airport, and two months after the Chinese directed their largest freight carrier — China Cargo Airlines — to begin direct talks with the airport, the story said. Schmitt  argued  at the time that the tax credits would be issued only if certain investment and trade occurred. His bill called for $420 million of incentives to build warehouses and distribution centers within a 50-mile radius of Lambert; and $60 million in tax credits for companies shipping exports out of Missouri. Schmitt said facilities built under the bill could be used to store meat that could be sent to China. Without the bill, Schmitt didn’t see the China hub materializing, the St. Louis Beacon  reported . The Team PAC ad didn’t mention the hub’s potential to handle exports, but one of the articles it cited, a St. Louis Post-Dispatch  editorial , said the City of St. Louis was negotiating with China Cargo Airlines ""to bring Chinese-made goods to America through Lambert and to take American goods and agricultural products back overseas."" To back its claim that the airline was ""owned by China's Communist Party,"" the super PAC ad cited a U.S. Securities and Exchange Commission  filing  for 2011 by Shanghai-based China Eastern Airlines, in connection with securities listed on the New York Stock Exchange. The 2011 filing does not make clear the precise level of Chinese government ownership in China Cargo. Here’s what it does say: Most of the major airline companies in China were majority-owned either by the central government or by provincial or municipal governments in China. The Chinese government controlled a 59.53% equity stake in a holding company that was China Eastern’s biggest shareholder. China Eastern owned 51% of ""subsidiary"" China Cargo. So the filing indicates that the Communist government had at least an indirect stake in China Cargo. Under the version ultimately approved by the Missouri legislature, Schmitt’s  bill  would have  provided   $360 million  in tax credits. But the bill  was not  signed into law, and the  project   was scrapped . The second part of the claim alludes to a 2013 state  law , which Schmitt  voted   for , on the ownership of agricultural land by foreign businesses.  Before the law, foreign businesses generally were prohibited from owning agricultural land in Missouri; the change loosened the prohibition, capping foreign ownership at 1% of Missouri’s total agricultural acreage. The measure was approved over the veto of then-Gov. Jay Nixon, a Democrat. The law allowed a Chinese company, Shuanghui International of Hong Kong, to buy Virginia-based Smithfield Foods, which owned Missouri farmland at the time, the Post-Dispatch  reported .  But what Schmitt voted for was not approval of any specific land purchases by China. China is a recurring theme in ads for Senate contests in several states. In a race for an open seat in Pennsylvania, Dr. Mehmet Oz  accused  fellow Republican David McCormick of giving Chinese companies billions of dollars through the hedge fund he ran. A super PAC supporting Republican Josh Mandel for an open seat in Ohio  claimed  that Republican Jane Timken’s family business moved jobs to China. Meanwhile, Alex Lasry, one of the Democrats challenging GOP incumbent Ron Johnson in Wisconsin,  pledged  to ""finally stand up to China."" The Missouri race is to succeed two-term GOP Sen. Roy Blunt, who is  not  seeking re-election. The primary is  Aug. 2  for the seat, which is  rated   as   solid  Republican. Greitens  resigned as governor in 2018 after facing a felony computer tampering charge, which was dropped, and allegations related to an extramarital affair.  Schmitt  formerly served as Missouri’s secretary of state and as a state senator.  The other GOP candidates include U.S. Reps.  Vicky Hartzler  and Billy Long; Long’s campaign gained attention for  running an ad  claiming that Democrats ""rigged"" the 2020 presidential election. Also among the GOP candidates are state Senate President Dave Schatz and attorney Mark McCloskey, who is best known for  pointing a gun  at protesters when they marched past his St. Louis home.  Team PAC raised  $2.5 million  in 2021, according to the Federal Election Commission — all of it from a suburban Chicago billionaire, Republican  donor   Richard Uihlein .  Uihlein, who owns a giant shipping supply company, is the second-largest individual donor to outside spending groups for the 2022 campaign cycle, having contributed $10.2 million,  according  to the nonprofit Open Secrets. As a  super PAC , Team PAC may raise unlimited sums of money from corporations, unions, associations and individuals, then spend unlimited sums to advocate for or against political candidates. Team PAC said Schmitt ""sponsored a bill to spend $480 million of your tax dollars to create a cargo hub here for airlines owned by China's Communist Party"" and ""voted to let China buy up Missouri farmland."" Schmitt’s 2011 bill initially called for $480 million in tax credits, not state expenditures, for a proposed air cargo hub to support international trade, including exports, with a Chinese airline as a potential partner; the tax credits would have been contingent on investment and trade occurring. The bill did not become law. Schmitt’s vote for a 2013 bill that became law allowed for foreign businesses to own a limited amount of agricultural land in Missouri. The statement is based on bills that Schmitt supported in the legislature, but it leaves out important context about his vote and the effect of the legislation. We rate it Half True.",2/9/22,https://www.politifact.com/factchecks/2022/feb/09/team-pac/race-open-us-senate-seat-missouri-fact-checking-pa/,1,,Eric Schmitt voted to spend $480 million of tax dollars on cargo hub for airlines owned by China's Communist Party
