claim,summary,review,date,url,useful,,claim_entered
"""Sen. (Richard) Burr voted no on the Violence Against Women Act.""","In N.C. Senate race, claim by Democrat Deborah Ross against GOP's Richard Burr is misleading.","In a recent  campaign ad , North Carolina Democrat Deborah Ross blasted her opponent, Republican Sen. Richard Burr, for voting against the landmark Violence Against Women Act. ""Sen. Burr voted no on the Violence Against Women Act,"" a narrator says in the ad, while the text, ""Richard Burr: Opposed Violence Against Women Act,"" appears on the screen, along with a citation for a bill considered in the Senate in 2012. Here’s a screenshot from the ad: Is Ross’ ad correct? In part, but it it leaves out important context. What was Burr voting for? First, we should note that the ad used some loose language about what Burr was actually voting on. The 2012 vote referenced in the ad was for a  reauthorization  bill -- that is, an updating of the existing Violence Against Women Act, which had  lapsed in 2011 . Burr was not in Congress when the act itself was initially passed in 1994; he was sworn in for his first term in the U.S. House the following year, in 1995. The 2000 and 2005 votes Congress voted to reauthorize the act in both 2000 and 2005, and both legislative efforts were fairly uncontroversial. For the 2000 effort, Burr was in the House, and he voted in favor of the reauthorization, which was  passed  by the overwhelming margin of 415-3. While that version didn’t become law, another version did become law during that Congress; it passed the House by  voice vote . Individual House members’ votes aren’t recorded in a voice vote, but they are usually only held for non-controversial measures. By the time the 2005 reauthorization effort rolled around, Burr had been elected to the Senate. The reauthorization bill passed the Senate by  unanimous consent , a process by which senators are given a chance to object to a bill and, if there no objections are made, the bill is deemed passed. So Burr would not have opposed the 2005 reauthorization. The 2012 vote The 2012 reauthorization effort was far more controversial than the previous two, since it involved changes that some social conservatives found objectionable. At the time, the Democrats controlled the presidency and the Senate, while the Republicans controlled the House. The Senate bill would ""allow Indian tribal courts to try certain non-Indians in some cases of domestic violence on reservations, expand the number of temporary visas for illegal immigrants who were victims of domestic violence and extend the protections of that act to gay men and lesbians,"" the  New York Times   reported  at the time. These provisions were  anathema  to many conservatives, and when faced with a vote on  April 26, 2012 , Burr was one of 31 Republicans to vote against it, while 15 Republicans voted for it. Overall, the measure passed the chamber by a 60-31 margin. Instead, Burr  voted  for a failed Republican-sponsored  amendment  that would have stripped out some of the elements of the bill that were controversial to Republicans. We were unable to find a contemporaneous explanation by Burr on the reason for his vote through Google or Nexis. The only  comment  he made on the bill to a media outlet came was procedural rather than substantive, when he said that he thought there were more urgent bills for the chamber to prioritize than the reauthorization. Ultimately, the Republican-led House passed a version that omitted the provisions of the Senate bill that conservatives opposed. The House and Senate were unable to come to an agreement, and the measure was dead for the duration of that Congress. It’s worth noting that Politico reported on  March 14, 2012 , that the Democratic effort to push a vote on the Violence Against Women Act in the spring of 2012 was to make it a ""political weapon."" ""Republicans have several objections to the legislation, but instead of making changes, Schumer wants to fast-track the bill to the floor, let the GOP block it, then allow Democrats to accuse Republicans of waging a ‘war against women,’ "" the Politico story said. ""It’s fodder for a campaign ad, and it’s not the only potential 30-second spot ready to spring from Senate leadership these days."" With this ad, that mission was accomplished. The 2013 vote After the failure to get the two chambers to agree on a single version in 2012, the new Congress took up the effort again in 2013. Partisan control of each part of government remained the same in 2013, and the reauthorization effort played out in a similar fashion. Republicans pursued an amendment to strip out some of the elements they found problematic, such as the provisions related to native Americans and gender identity. On Feb. 7, 2013, the amendment failed by a  34-65  margin, with Burr voting in favor of it. Then, on  Feb. 12, 2013 , the Senate passed the original measure, 78-22. Burr was among a handful of Republican senators who switched their position and supported the bill. In fact, Burr has subsequently trumpeted elements of this bill. Burr joined with Sen. Barbara Boxer, D-Calif., to introduce the  Child Protection Compact Act , which was enacted as part of the Violence Against Women Act reauthorization. This provision ""seeks to protect and rescue children from trafficking by creating ‘Child Protection Compacts’ between the United States and countries with significant numbers of children in human trafficking,"" Burr’s Senate  website  says. On the other hand, the Ross camp argues, the refusal of Republicans to approve the original bill resulted in a year-long delay in the reauthorization, which kept sexual violence awareness and assistance programs on college campuses from being established, even though reports of sexual assault on college campuses were at an  all-time high . So where does this leave us? The Ross camp argues that the ad is accurate since it said that Burr voted against the 2012 version of the bill. They have a point, but making this argument requires ignoring that Burr voted to reauthorize the Violence Against Women Act three times -- in 2000, 2005 and 2013 -- even as he voted against it once, in 2012. The Ross camp also argues that the 2012 vote is important because Burr opposed -- and even voted to strip -- provisions involving LGBT and native Americans. They also have a point here, but their argument would have been stronger had the ad specifically cited Burr’s actions toward LGBT and native Americans. The ad makes no such distinctions; a viewer would be left to assume that he opposed anything to combat violence against women. Finally, we think it’s relevant to note here that, according to Politico, the Democrats specifically teed up this vote to put Republicans in a bind so they could use their votes in campaign ads -- a tactic that both parties have used when they are in a position to do so. Our ruling Ross’ ad said Burr ""voted no on the Violence Against Women Act."" Burr did vote against the 2012 version of the law’s reauthorization, which was important because it effectively meant delaying the revival of an act that had expired. However, the ad ignores that three other times over 13 years Burr voted for a reauthorization of the same law. We rate the statement Half True.",10/18/16,https://www.politifact.com/factchecks/2016/oct/18/deborah-ross/nc-senate-race-democrat-deborah-ross-ad-against-go/,1,,
"Sen. Johnny Isakson voted for a trade agreement, ""with China costing Georgia 93,000 jobs.""",Barksdale cherry picks numbers to attack Isakson on trade.,"The latest polls indicate Democrat Jim Barksdale has an uphill battle against two-term incumbent Republican U.S. Sen. Johnny Isakson in Georgia. Barksdale, a multi-millionaire businessman, has pounced on an issue where he thinks Isakson is vulnerable -- trade agreements and their connection to lost jobs in the state. In his latest ad, he makes a statement about Isakson’s vote on Permanent Normal Trade Relations (PNTR) with China. In a recent campaign video, Barksdale said, ""Johnny voted for PNTR with China costing Georgia 93,000 jobs."" Isakson, who has been in Congress since 1999, faces Barksdale and Libertarian candidate Allen Buckley in the Nov. 8 general election. Did Isakson vote for legislation that cost the state jobs? PolitiFact Georgia decided to look into the statement. We reached out to the candidate’s camps for some background. Barksdale’s campaign spokesperson Gregory Minchak said the number comes from a 2014  Economic Policy Institute study  that found millions of jobs were displaced after the agreement with China, including 93,700 in Georgia. For some perspective on the state’s relationship with China in recent years, Isakson’s spokesperson Marie Gordon pointed to a 2015  Georgia Department of Economic Development study  that says the state’s exports to China totaled $2.6 billion, ranking 12th among Georgia’s top exporter nations. The state’s imports from China totaled $19.7 billion, making China 7th among Georgia’s top importer nations. It may be important to note Georgia has a Republican governor and legislature, and Gov. Nathan Deal has made multiple trips to the country as governor. Isakson’s campaign also referenced a  Heritage Foundation study  that says the U.S. economy  added  over 3 million net new jobs. Isakson’s record Permanent Normal Trade Relations (PNTR) with China have been in effect since 2000, when President Bill Clinton signed a bill normalizing relations into law. Trade conditions with China previously had to be renewed on an annual basis. Isakson was first elected as a representative to Congress in 1999. He   voted for the bill  to normalize trade with China in May 2000, and it was signed into law by Clinton in October 2000. Isakson is also  in favor of the Trans-Pacific Partnership, a trade agreement to reduce barriers to trade in Pacific Rim countries while curbing China’s influence in the area. The agreement still needs to be passed by Congress. Barksdale says later in the ad he will not vote for ""bad"" trade deals and is opposed to corporate tax breaks. Throughout the campaign, the investment manager has channeled the anti-establishment nature of Sen. Bernie Sanders more than that of presidential nominee Hillary Clinton. Isakson’s counterattack ads have called Barksdale a hypocrite, and said his fortune comes from companies that outsource jobs to China. Since then, the strongest effort to scale back trade with China came in 2005 (the year Isakson entered the Senate) when then-Rep. Sanders led an effort to repeal the bill due to jobs being lost overseas. The Math The 2014  study from the liberal-leaning Economic Policy Institute  found ""3.2 million jobs were lost or displaced"" by trade with China between 2001 and 2013. Georgia lost 93,700 jobs, putting the state at number ten for jobs lost in the country. The report concludes, ""Since China entered the World Trade Organization in 2001, the massive growth of trade between China and the United States has had a dramatic and negative effect on U.S."" Experts say these are some of the most dismal jobs numbers cited in reference to trade with China. The U.S. International Trade Commission disputes the EPI’s methodology. Spokesperson Matthew McAlvanah said in an email, ""up to half of all U.S. imports are intermediate goods that go into supporting U.S. production (and U.S. jobs). Many other imports are goods we do not produce at all in the United States, which have no impact on U.S. employment."" In short, importing a good does not mean an American job is lost if the good cannot be grown or made in America. Some studies have found an increase in jobs since the bill’s passage. Most notably, the  Heritage Foundation study  citing U.S. Bureau of Labor Statistics numbers refutes the idea that trade with China has led to job loss. It says, ""from 1999 to 2011, the U.S. economy  added  over 3 million net new jobs."" To figure out how these relations work, a  2011 report from the nonpartisan Congressional Research Service  sums the situation up well: ""U.S. firms that use China as the final point of assembly for their products, or use Chinese-made inputs for production in the United States, are able to lower costs and become more globally competitive... On the other hand, many analysts argue that growing economic ties with China have exposed U.S. manufacturing firms to greater, and what is often perceived to be ‘unfair’ competition from low-cost Chinese firms. They argue that this has induced many U.S. production facilities to relocate to China, resulting in the loss of thousands of U.S. manufacturing jobs."" Additionally, the U.S. Chamber of Commerce has argued in favor of PNTR with China, saying it, ""is vital to our national economic prosperity."" Our ruling Barksdale said his  opponent in Georgia’s U.S. Senate race voted for trade legislation  ""with China costing Georgia 93,000 jobs."" Barksdale is correct that Isakson voted for the bill to normalize trade with China in 2000 and cites a 2014 number that said Georgia lost 93,700 jobs. One prominent study shows that. But other studies show the state actually gained jobs over the long run. Barksdale cherry picks his studies on this issue to make a point. We rate his claim Half True. https://www.sharethefacts.co/share/e10d6d82-6c78-47e2-ad80-b53650258923",10/15/16,https://www.politifact.com/factchecks/2016/oct/15/jim-barksdale/barksdale-cherry-picks-numbers-attack-isakson-trad/,1,,
"Says Colorado congressional candidate Morgan Carroll ""voted to allow welfare recipients to use your tax dollars at ATMs at strip clubs and pot dispensaries.""","NRCC: Morgan Carroll voted to let welfare recipients use benefit cards at strip club, pot shop ATMs.","A Republican group has launched a racy ad saying Colorado state Sen. Morgan Carroll, a Democratic congressional candidate, voted to allow welfare recipients to use public benefit cards at ATMs in strip clubs and marijuana dispensaries. The National Republican Congressional Committee’s ad shows how down and dirty the race between Carroll and Republican incumbent Rep. Mike Coffman is getting in the final sprint to Election Day. They’re fighting over suburban Denver’s 6th Congressional District, one of the nation’s most competitive swing districts. ""Career politicians waste lots of money. Morgan Carroll is one of the worst,"" the narrator says at the beginning of  the ad, titled ""Clubs."" ""Carroll voted to allow welfare recipients to use your tax dollars at ATMs at strip clubs and pot dispensaries,"" the narrator continues as the video shifts from Carroll addressing the Legislature to her standing at a podium in front of a red neon silhouette of a nude female figure and the words ""STRIPPERS"" and ""MORGAN CARROLL"" on a brick wall. There's a row of marijuana-filled jars beside the senator. ""It's enough to make you ask, 'What's Morgan Carroll thinking?' Welfare for lap dances? Morgan Carroll is careless with our money,"" the ad concludes. We examined the claim that ""Carroll voted to allow welfare recipients to use your tax dollars at ATMs at strip clubs and pot dispensaries."" The facts are fairly straightforward. Carroll was among a dozen Democratic senators who voted against final passage of a 2015 bill to prohibit welfare recipients from using state-issued  electronic benefit transfer (or EBT) cards  to obtain cash from ATMs at pot shops and strip clubs. Low-income families use these debit cards to buy ""essential goods"" such as food and clothing and to help pay for utilities and rent. Senate Bill 65 , which became law, expanded on existing state law prohibiting people from using the cards to withdraw ATM cash at liquor stores, casinos and gun shops. Federal law already required states to prevent people receiving public benefits from using EBT cards at liquor stores, gambling and adult entertainment venues. Colorado also has had trouble preventing people from withdrawing ATM cash totalling hundreds of thousands of dollars at casinos and liquor stores, according to  Watchdog.org . State officials and lawmakers  warned that Colorado would face financial sanctions for failing to comply with federal prohibitions against EBT card use at strip clubs. There were also concerns about a federal crackdown after  several reports  of people using the benefit cards at shops selling medical or recreational marijuana -- a drug that’s legal under state law but illegal under federal law. ""We stand to lose a lot if we don't show we are trying"" to prevent the use of tax money for marijuana, Republican Sen. Vicki Marble, a primary sponsor of the bill, told the  Associated Press  last year. ""The growers here put in a lot of time and effort. A raid would be absolutely devastating to our state."" Why did Carroll -- along with many other Democratic senators -- vote against the bill? ""The reason she voted against it was because of 'banking deserts,' where many poor people don't have"" bank ATMs in their neighborhoods, said Carroll campaign spokesman Drew Godinich. Removing their ability to get cash from ATMs at the many marijuana dispensaries that dot Colorado cities and towns hampers low-income families’ ability to access money to purchase legitimate products elsewhere, he added.   According to  the Atlantic  magazine, a March study by the Federal Reserve Bank of New York on the increase of ""banking deserts"" found that ""lower-income communities and communities of color have historically and disproportionately limited access to mainstream banking services."" This makes it harder for people in these communities to manage their finances and build wealth, the study said. Democratic lawmakers had repeatedly defeated similar legislation, arguing that improper ATM withdrawals at strip clubs, liquor stores, casinos represent a tiny fraction of the total use of cash-assistance cards, the  Denver Post  reported. Critics also note that the 2015 law doesn't prevent someone on welfare from using their EBT card to make a withdrawal at a supermarket ATM and then go spend the cash at a pot shop or a strip club. Our ruling NRCC says, ""Carroll voted to allow welfare recipients to use your tax dollars at ATMs at strip clubs and pot dispensaries."" There's slightly more to this than the NRCC lets on: Carroll voted, unsuccessfully, to allow welfare recipients to continue withdrawing money from ATMs at strip clubs and pot dispensaries.  Carroll’s spokesman said the senator voted against the bill that prohibited people from using public benefit cards for cash withdrawals at strip clubs and marijuana dispensaries because she was concerned about the impact on residents of poor neighborhoods where there are few -- if any -- banking services. State officials and lawmakers warned that Colorado could face financial sanctions for failing to comply with federal prohibitions against the use of benefit cards at adult entertainment venues. With that additional information in mind, we rate the claim Mostly True. https://www.sharethefacts.co/share/db00eb39-eb87-464b-92df-ce08bfbe0d45",10/13/16,https://www.politifact.com/factchecks/2016/oct/13/national-republican-congressional-committee/nrcc-morgan-carroll-voted-let-welfare-recipients-u/,1,,
"Says ""Rob Portman voted for the bipartisan bill to affirm climate change is real, humans significantly contribute to it and it needs to be addressed.""",Super PAC yanks ad about Portman's climate change views.,"ClearPath Action Fund, a conservative clean-energy and environmental PAC, cheered U.S. Sen. Rob Portman in a  digital ad , calling him a ""clean energy champion."" The ad said of the Republican senator, ""Rob Portman voted for the bipartisan bill to affirm climate change is real, humans significantly contribute to it and it needs to be addressed."" PolitiFact previously  looked into  how many Republicans in Congress say they believe that climate change is real, and caused by human activity. The Republican lawmakers we identified who affirm climate change included  Rep. Michael Grimm, N.Y .;  Sen. Susan Collins, Maine ;  Sen. Lamar Alexander, Tenn.;   Sen. Mark Kirk, Ill .;  Rep. Chris Smith, N.J .;  Sen. Bob Corker, Tenn. ;  Sen. John Thune, S.D .; and  Rep. Rodney Frelinghuysen, N.J . Portman didn’t make PolitiFact’s list, so we wanted to clarify his climate change stance. We asked ClearPath Action Fund for the sources they used to champion Portman’s position, and a spokesman sent us three links. The first two were votes on amendments to the Keystone XL Pipeline Act in January 2015 (which was after PolitiFact did its roundup of Republicans who believe in climate change). The climate change amendments were only symbolic gauges of the ""sense of the Senate."" Portman voted ""yea"" on the first, introduced by Democratic Sen. Sheldon Whitehouse, ""to express the sense of the Senate that climate change is real and not a hoax."" That amendment passed. Portman also voted in support of a second amendment by Republican Sen. John Hoeven, a Keystone bill sponsor, which said that human activity affects climate change, but still supported the passage of the pipeline bill. That amendment fell short of the required 60 by one vote, and Hoeven himself voted against it.   So far, so good for ClearPath Action Fund. Here's how one wrong word — ""significantly"" — pulls the PAC's praise for Portman's record into negative territory.  A Democrat, Hawaii Sen. Brian Schatz, inched the global warming language a step further, calling for a vote on an amendment that stated ""human activity significantly contributes to climate change."" The adverb represents the crux of the partisan divide over climate change. The word ""significantly"" was significant enough for Portman to vote against that amendment, along with almost all of his fellow Republicans. Collins, Kirk, Alexander, Lindsey Graham (S.C.) and Kelly Ayotte (N.H.) broke party lines and voted in favor.  Portman has explained in  interviews  that he doesn’t want to qualify the impact that human activity has on the climate because ""scientists have different views on that."" These word gymnastics are necessary for Portman because of his large constituency in  Ohio coal country . Coal-burning power plants provide 44 percent of the electricity used in the U.S., but are the biggest contributor to air pollution, according to the  Union of Concerned Scientists .  ""Sense of the Senate resolutions are done for messaging reasons, either in an attempt to move the policy debate, or to provide political cover of some sort. I think you had both types in play with the Keystone vote,"" said David Jenkins, president at Conservatives for Responsible Stewardship. More recently, Portman voted for an amendment proposed by  Graham  that stated, ""Climate change is real; human activity contributes to climate change,"" and that ""the United States should be a world leader in addressing climate change…(and) Congress has a responsibility to take actions that reduce emissions and combat climate change..."" Absent, again, is the word ""significantly."" But it is in the language of the ClearPath Action ad: ""Rob Portman voted for the bipartisan bill to affirm climate change is real, humans significantly contribute to it and it needs to be addressed."" ClearPath Action’s communications director, Darren Goode, responded immediately to PolitiFact via email, and said the group had made an ""honest mistake"" by including the s-word. ""We have already pulled that video down and will fix it to reflect that,"" Goode wrote.   While ClearPath Action confers ""clean energy champion"" status to Portman, at least two other environmental groups beg to differ. The National Resources Defense Council has  regularly  hammered  Portman  for sponsoring such measures as a budget amendment to allow states to opt out of the 1970 Clean Art Act and Clean Power Plan requirements for cutting carbon pollution. Likewise, the League of Conservation Voters gives Portman a  low  rating on their scorecard for his voting record on environmentally impactful measures. Our ruling An ad by ClearPath Action said, ""Rob Portman voted for the bipartisan bill to affirm climate change is real, humans significantly contribute to it and it needs to be addressed."" While Portman did vote for a bipartisan bill recognizing climate change as a threat in need of action, that bill did not include the word ""significantly."" Portman has voted against other amendments when they include the word ""significantly,"" and has voted for amendments that do not quantify how much human activity affects climate change. ClearPath Action has since discontinued the ad, admitted the mistake and pledged to release a corrected version. We rate the original version of the ad Mostly False. https://www.sharethefacts.co/share/67974c57-e2bb-4327-a497-e2db21a126f0",10/10/16,https://www.politifact.com/factchecks/2016/oct/10/clearpath-action-fund/response-politifact-ohio-super-pac-takes-down-its-/,1,,
